{
  "compute_context_version": "0.1",
  "contract_digest": "8ea8fd8307a5e05cb2c56e31a66edb6bb233a111c567cc72315a31219b14fe0a",
  "base_context_mac": "1ac317d917b16776051f926b21e27bd189f88445e73b6f45147444350d223a98",
  "producer_id": "buzz-gateway.example",
  "compute_context_mac": "2a701a7aebcdab52a88a079803ddd3f139ed954eaab19f54afd170305e785961",
  "membership_event_id": "cccccccccccccccccccccccccccccccccccccccccccccccccccccccccccccccc",
  "status_event_id": "dddddddddddddddddddddddddddddddddddddddddddddddddddddddddddddddd",
  "status_created_at": "2026-07-23T11:59:00Z",
  "member_pubkey": "eeeeeeeeeeeeeeeeeeeeeeeeeeeeeeeeeeeeeeeeeeeeeeeeeeeeeeeeeeeeeeee",
  "mesh_owner_id": "02d449a31fbb267c8f352e9968a79e3e5fc95c1bbeaa502fd6454ebde5a4bedc",
  "mesh_owner_verifying_key": "1111111111111111111111111111111111111111111111111111111111111111",
  "endpoint_id": "iroh-endpoint-1234567890abcdef",
  "endpoint_token_sha256": "ffffffffffffffffffffffffffffffffffffffffffffffffffffffffffffffff",
  "model_id": "unsloth/gemma-4-26B-A4B-it-GGUF:UD-Q4_K_M",
  "membership_verified": true,
  "owner_binding_verified": true,
  "endpoint_binding_verified": true,
  "roster_enforced": true,
  "transport_policy_checked": true,
  "status_fresh": true,
  "input_tokens": 1200,
  "output_tokens": 180,
  "prompt_visibility": "serving_member",
  "model_integrity": "advertised_only",
  "verified_at": "2026-07-23T12:00:00Z"
}
